Event Date,Headliner,sp artist_name,sp artist_genre,sp followers,sp popularity,yt name,yt Channel ID,yt Title,yt Description,yt Published At,yt View Count,yt Subscriber Count,yt Video Count,Total population,Under 5 years population,5 to 9 years population,10 to 14 years population,15 to 19 years population,20 to 24 years population,25 to 34 years population,35 to 44 years population,45 to 54 years population,55 to 59 years population,60 to 64 years population,65 to 74 years population,75 to 84 years population,85 years and over population,Median age,Year,headliner_monthly_listeners,Support_Total_Monthly_Listeners,monthly_listeners,Number of Shows,Support,Venue,City,State,Country,Market,Company Type,Currency,Promoter,Genre,Avg. Tickets Sold,Avg. Gross USD,Avg. Event Capacity,Avg. Capacity Sold,Ticket Price Min USD,Ticket Price Max USD,Ticket Price Avg. USD,Month,day_of_week
2024-09-18,Creed,Creed,"['alternative metal', 'nu metal', 'post-grunge', 'rock']",3527070.0,74.0,Creed,UCP-tFf_VMQzhyeKMONL1KvQ,Creed,Subscribe to Creed's Official Youtube Channel to see the latest videos from the band!,2009-03-30T21:30:11Z,1530589615.0,1870000.0,145.0,465517.0,25578.0,25274.0,26366.0,32848.0,39470.0,86563.0,67091.0,60170.0,26831.0,22056.0,32176.0,14987.0,6107.0,34.6,2024.0,8513892.0,0.0,8513892.0,1,"3 Doors Down, Finger Eleven",Coastal Credit Union Music Park at Walnut Creek,Raleigh,North Carolina,United States,Raleigh-Durham (Fayetteville) ,Amphitheatre,US DOLLAR,Live Nation,Pop / Rock,20295.0,1228939.0,20295.0,100%,39.5,225.0,60.55,9,2
2024-09-14,Creed,Creed,"['alternative metal', 'nu metal', 'post-grunge', 'rock']",3527070.0,74.0,Creed,UCP-tFf_VMQzhyeKMONL1KvQ,Creed,Subscribe to Creed's Official Youtube Channel to see the latest videos from the band!,2009-03-30T21:30:11Z,1530589615.0,1870000.0,145.0,118402.0,6911.0,9154.0,11090.0,7877.0,5185.0,11317.0,15998.0,19779.0,8835.0,5980.0,10148.0,4306.0,1822.0,40.7,2024.0,8532672.0,0.0,8532672.0,1,"3 Doors Down, Finger Eleven",The Cynthia Woods Mitchell Pavilion,The Woodlands,Texas,United States,Houston,Amphitheatre,US DOLLAR,Live Nation,Pop / Rock,16308.0,1374174.0,16308.0,100%,39.5,225.0,84.26,9,5
2024-09-13,Bruce Springsteen & The E Street Band,Bruce Springsteen & The E Street Band,"['heartland rock', 'mellow gold', 'permanent wave', 'rock', 'singer-songwriter']",6567386.0,79.0,Bruce Springsteen & The E Street Band,UCcu7ANuD9J7hnTQCREqIc4Q,Bruce Springsteen,Bruce Springsteen's official YouTube channel. ,2006-04-01T18:32:28Z,2497451426.0,2160000.0,133.0,584548.0,35412.0,31757.0,33877.0,34933.0,38348.0,108037.0,77668.0,64094.0,35439.0,38588.0,52849.0,23684.0,9862.0,36.0,2024.0,0.0,0.0,,1,,Oriole Park at Camden Yards,Baltimore,Maryland,United States,Baltimore,Stadium,US DOLLAR,Live Nation,Pop / Rock,39646.0,6556587.0,39646.0,100%,49.5,299.5,165.38,9,4
2024-09-13,Creed,Creed,"['alternative metal', 'nu metal', 'post-grunge', 'rock']",3527070.0,74.0,Creed,UCP-tFf_VMQzhyeKMONL1KvQ,Creed,Subscribe to Creed's Official Youtube Channel to see the latest videos from the band!,2009-03-30T21:30:11Z,1530589615.0,1870000.0,145.0,1445662.0,92933.0,94254.0,99836.0,106064.0,114945.0,234112.0,196145.0,169183.0,80722.0,72343.0,110192.0,52561.0,22372.0,34.1,2024.0,8532672.0,0.0,8532672.0,1,"3 Doors Down, Finger Eleven",Frost Bank Center,San Antonio,Texas,United States,San Antonio,Arena,US DOLLAR,Live Nation,Pop / Rock,14995.0,1402969.0,14995.0,100%,39.5,225.0,93.56,9,4
2024-09-13,"Billy Joel, Rod Stewart","Billy Joel, Rod Stewart","['album rock', 'classic rock', 'mellow gold', 'piano rock', 'rock', 'singer-songwriter', 'soft rock']",6312751.0,79.0,"Billy Joel, Rod Stewart",UC0yYX8_4R-pITDGp0YC_Qfg,Rock Playlist,,2024-02-28T03:11:06.872221Z,25.0,8.0,1.0,370365.0,20791.0,21843.0,22134.0,23719.0,27167.0,63028.0,43951.0,42947.0,25160.0,25584.0,32400.0,15238.0,6403.0,36.3,2024.0,0.0,0.0,,1,,Huntington Bank Field,Cleveland,Ohio,United States,Cleveland-Akron (Canton) ,Stadium,US DOLLAR,Live Nation,Pop / Rock,44553.0,9676590.0,44553.0,100%,69.5,349.5,217.19,9,4
2024-09-13,HARDY,,,,,,,,,,,,,,,,,,,,,,,,,,,,2024.0,11437609.0,0.0,11437609.0,1,"Travis Denning, Randy Houser",Dudy Noble Field,Starkville,Mississippi,United States,,Untyped Venue,US DOLLAR,Live Nation,Country,11367.0,1072431.0,14300.0,79%,29.11,330.0,94.35,9,4
2024-09-11,Creed,Creed,"['alternative metal', 'nu metal', 'post-grunge', 'rock']",3527070.0,74.0,Creed,UCP-tFf_VMQzhyeKMONL1KvQ,Creed,Subscribe to Creed's Official Youtube Channel to see the latest videos from the band!,2009-03-30T21:30:11Z,1530589615.0,1870000.0,145.0,1300642.0,91653.0,85675.0,88582.0,82736.0,98586.0,242292.0,179308.0,150701.0,70126.0,67491.0,87138.0,39474.0,16880.0,33.1,2024.0,8524731.0,0.0,8524731.0,1,"3 Doors Down, Finger Eleven",Dos Equis Pavilion,Dallas,Texas,United States,Dallas-Ft. Worth,Amphitheatre,US DOLLAR,Live Nation,Pop / Rock,19303.0,1512310.0,19303.0,100%,39.5,159.5,78.35,9,2
2024-09-11,"Greg ""G"" Williams",,,,,,,,,,,,,,,,,,,,,,,,,,,,2024.0,0.0,0.0,,1,,City Winery Pittsburgh,Pittsburgh,Pennsylvania,United States,Pittsburgh,Club,US DOLLAR,(In-House Productions) / City Winery,Comedy,40.0,1240.0,220.0,18%,25.0,35.0,31.0,9,2
2024-09-11,$uicideboy$,,,,,,,,,,,,,,,,,,,,,,,,,,,,2024.0,12551812.0,0.0,12551812.0,1,"Denzel Curry, Pouya, EKKSTACY, Shakewell, Haarper",Paycom Center,Oklahoma City,Oklahoma,United States,Oklahoma City,Arena,US DOLLAR,AEG Presents,Rap / HipHop,9505.0,956748.0,11329.0,83%,34.5,195.5,100.66,9,2
2024-09-11,Goose,Goose,"['jam band', 'jamtronica']",159609.0,53.0,Goose,UCNMe_yeW_kCrjRImbUiQ3ZA,Goose,"Goose released their debut album in 2016 and quickly took flight, playing countless shows while steadily amassing a fervent fan following for their unique brand of irresistible songcraft, fluid musicianship, and spirited improvisational performance. 2022 proved a career-defining year for the Connecticut-based quintet with their critically acclaimed third studio album, Dripfield. Fueled by such hypnotic tracks as “Hungersite” (which spent multiple weeks among the top 10 at Triple A radio outlets nationwide), the album proved a phenomenon, debuting at #2 on Billboard’s “Top New Artist Albums” chart amidst critical applause from such national outlets as Rolling Stone, which hailed it as “both sweet headphone ear candy and the foundation for a perfect live peak.”

Goose are: Rick Mitarotonda (vocals, guitar), Peter Anspach (vocals, keys, guitar), Trevor Weekz (bass),  Jeff Arevalo (vocals, percussion, drums) and Cotter Ellis (drums)
",2015-03-13T14:51:04Z,29125599.0,86600.0,378.0,2721914.0,156309.0,142899.0,155086.0,155446.0,200844.0,535502.0,390000.0,322013.0,154928.0,147739.0,211359.0,104397.0,45392.0,35.3,2024.0,338363.0,0.0,338363.0,3,,The Salt Shed - Outdoor,Chicago,Illinois,United States,Chicago,Stadium,US DOLLAR,"(In-House Promotion), 16 On Center",Pop / Rock,4836.0,315799.79,15750.0,30%,55.0,149.5,65.3,9,2
2024-09-10,Sierra Green & The Giants,,,,,,,,,,,,,,,,,,,,,,,,,,,,2024.0,0.0,0.0,,1,,City Winery Pittsburgh,Pittsburgh,Pennsylvania,United States,Pittsburgh,Club,US DOLLAR,(In-House Productions) / City Winery,RB / Soul,28.0,560.0,220.0,12%,20.0,25.0,20.0,9,1
2024-09-10,Creed,Creed,"['alternative metal', 'nu metal', 'post-grunge', 'rock']",3527070.0,74.0,Creed,UCP-tFf_VMQzhyeKMONL1KvQ,Creed,Subscribe to Creed's Official Youtube Channel to see the latest videos from the band!,2009-03-30T21:30:11Z,1530589615.0,1870000.0,145.0,69961.0,4948.0,5486.0,5280.0,4816.0,4889.0,10981.0,9766.0,9149.0,3786.0,3242.0,4161.0,2330.0,1127.0,33.4,2024.0,8524731.0,0.0,8524731.0,1,"Daughtry, Finger Eleven",Walmart AMP,Rogers,Arkansas,United States,Fort Smith-Fayetteville-Springdale-Rogers ,Amphitheatre,US DOLLAR,Live Nation,Pop / Rock,10945.0,801952.0,10945.0,100%,39.5,159.5,73.27,9,1
2024-09-10,Meghan Trainor,Meghan Trainor,"['hip pop', 'pop']",15386185.0,80.0,Meghan Trainor,UCkXgEcpoTE4tHsebYBouWpA,Meghan Trainor,"Meghan Trainor first made history in 2014 with her diamond-certified smash single “All About That Bass.” The GRAMMY® Award-winning singer, songwriter, and multi-instrumentalist stands out as “one of only five female artists to achieve a diamond certification from the RIAA” an honor bestowed upon only 15 other singles to date. Thus far, she has garnered a GRAMMY® Award and achieved eight multi-platinum singles and two platinum albums, sold out three world tours, penned multi-platinum hits for peers across pop and country, and received countless industry awards and nominations. Expanding her influence, she starred on FOX’s hit series THE FOUR: Battle for Stardom for two seasons. Following 2018 anthems “No Excuses” and “Let You Be Right,” she celebrated Valentine’s Day 2019 with the love-themed six-song The Love Train EP and to kick off the summer, she collaborated with dance music titan, Kaskade, for their song “With You,” paving the way for more surprises to come.",2008-06-04T23:37:31Z,9391426634.0,15200000.0,455.0,83630.0,5529.0,4983.0,6336.0,5340.0,5351.0,10451.0,13007.0,11470.0,5029.0,4517.0,6025.0,4011.0,1581.0,37.8,2024.0,25864440.0,0.0,25864440.0,1,Paul Russell,FirstBank Amphitheater,Franklin,Tennessee,United States,Nashville,Amphitheatre,US DOLLAR,Live Nation,Pop / Rock,5676.0,263345.0,7528.0,75%,28.5,118.5,46.4,9,1
2024-09-10,Jerome Collins,Jerome Collins,[],190.0,1.0,Jerome Collins,UCWXinxNiiYCTEfYndGCpqqw,Jerome Collins - Topic,,2021-04-22T11:22:40.514465Z,800.0,28.0,3.0,684103.0,44042.0,37677.0,36449.0,38591.0,49823.0,139881.0,97298.0,77338.0,40930.0,35587.0,53657.0,23974.0,8856.0,34.6,2024.0,73.0,0.0,73.0,1,,City Winery Nashville,Nashville,Tennessee,United States,Nashville,Club,US DOLLAR,"(In-House Productions) / City Winery, (In-House Promotion)",Pop / Rock,65.0,2611.0,314.0,20%,32.0,45.0,40.17,9,1
2024-09-08,The Killers,The Killers,"['alternative rock', 'dance rock', 'modern rock', 'permanent wave', 'rock']",7494388.0,79.0,The Killers,UCkhyoTaWKuB-Rdbb6Z3Z5DA,TheKillersMusic,"""Bright Lights"" out now. 
",2006-08-17T23:17:44Z,2654219847.0,2510000.0,33.0,106600.0,5894.0,5645.0,6741.0,6986.0,6802.0,15497.0,14767.0,13239.0,7417.0,6253.0,9648.0,5179.0,2532.0,38.8,2024.0,26261514.0,0.0,26261514.0,1,,Merriweather Post Pavilion,Columbia,Maryland,United States,"Washington, D.C. (Hagerstown) ",Amphitheatre,US DOLLAR,I.M.P.,Pop / Rock,15000.0,1278260.0,15000.0,100%,55.0,100.0,85.22,9,6
2024-09-08,Flor Bertotti,,,,,,,,,,,,,,,,,,,,,,,,,,,,2024.0,0.0,0.0,,1,,James L. Knight Center,Miami,Florida,United States,Miami-Ft. Lauderdale,Auditorium / Theatre,US DOLLAR,Blueteam Dream Makers LLC,Jazz,663.0,47038.7,2473.0,26%,48.0,375.0,70.95,9,6
2024-09-08,Paul Weller,Paul Weller,"['britpop', 'solo wave']",470288.0,54.0,Paul Weller,UC0YjP1dWiz1Q0sLhdks3irA,Paul Weller,"66, the new album from Paul Weller, available now: https://paulweller.lnk.to/66Album

",2008-04-30T10:24:34Z,61220863.0,92600.0,159.0,665945.0,31428.0,26801.0,29526.0,46290.0,66772.0,158449.0,86950.0,68883.0,36479.0,32331.0,48205.0,22488.0,11343.0,32.9,2024.0,716136.0,0.0,716136.0,1,,Citizens House of Blues Boston,Boston,Massachusetts,United States,Boston (Manchester) ,Club,US DOLLAR,Crossroads Presents,Pop / Rock,2263.0,80615.5,2425.0,93%,35.0,49.5,35.62,9,6
2024-09-08,Abbots Cross,,,,,,,,,,,,,,,,,,,,,,,,,,,,2024.0,0.0,0.0,,1,,City Winery Pittsburgh,Pittsburgh,Pennsylvania,United States,Pittsburgh,Club,US DOLLAR,(In-House Productions) / City Winery,World,82.0,2145.0,220.0,37%,20.0,30.0,26.16,9,6
2024-09-08,Don Omar,,,,,,,,,,,,,,,,,,,,,,,,,,,,2024.0,38230196.0,0.0,38230196.0,1,,Capital One Arena,Washington,District of Columbia,United States,"Washington, D.C. (Hagerstown) ",Arena,US DOLLAR,Cárdenas Marketing Network (CMN),"Latin, Rap / HipHop",7534.0,849135.8,7534.0,100%,59.0,189.0,112.71,9,6
2024-09-08,Chayanne,,,,,,,,,,,,,,,,,,,,,,,,,,,,2024.0,13420950.0,0.0,13420950.0,1,,Toyota Arena,Ontario,California,United States,Los Angeles,Arena,US DOLLAR,Cárdenas Marketing Network (CMN),Latin,8126.0,1223989.75,8126.0,100%,59.0,189.0,150.63,9,6
2024-09-07,DJ Rivas,,,,,,,,,,,,,,,,,,,,,,,,,,,,2024.0,0.0,0.0,,1,,The Grand,Boston,Massachusetts,United States,Boston (Manchester) ,Club,US DOLLAR,"(In-House Promotion), Big Night Entertainment Group",,64.0,1720.0,600.0,10%,15.0,100.0,26.88,9,5
2024-09-07,Bruce Springsteen & The E Street Band,Bruce Springsteen & The E Street Band,"['heartland rock', 'mellow gold', 'permanent wave', 'rock', 'singer-songwriter']",6567386.0,79.0,Bruce Springsteen & The E Street Band,UCcu7ANuD9J7hnTQCREqIc4Q,Bruce Springsteen,Bruce Springsteen's official YouTube channel. ,2006-04-01T18:32:28Z,2497451426.0,2160000.0,133.0,670587.0,41522.0,34637.0,32300.0,32279.0,45253.0,152345.0,108199.0,72665.0,33926.0,33010.0,49028.0,25256.0,10167.0,34.8,2024.0,0.0,0.0,,1,,Nationals Park,Washington,District of Columbia,United States,"Washington, D.C. (Hagerstown) ",Stadium,US DOLLAR,Live Nation,Pop / Rock,39765.0,7052608.0,39765.0,100%,49.5,299.5,177.36,9,5
2024-09-07,A.J. Croce,A.J. Croce,[],9685.0,25.0,A.J. Croce,UCmr0aoxojvHr5KqcAiUoHnw,A.J. Croce,,2010-11-09T16:10:55Z,1052667.0,7680.0,8.0,42404.0,2317.0,2733.0,2402.0,2732.0,2813.0,5946.0,5385.0,4428.0,2804.0,2513.0,4185.0,2638.0,1508.0,38.8,2024.0,22298.0,0.0,22298.0,1,,Midland Center for the Arts,Midland,Michigan,United States,Flint-Saginaw-Bay City,Auditorium / Theatre,US DOLLAR,"(In-House Promotion), Exceptional Artists, Mammoth",Pop / Rock,1457.0,75202.0,1497.0,97%,36.0,76.0,51.61,9,5
2024-09-07,Cody Johnson,,,,,,,,,,,,,,,,,,,,,,,,,,,,2024.0,10274474.0,0.0,10274474.0,1,"Wade Bowen, Ashland Craft",First Interstate Arena At MetraPark,Billings,Montana,United States,Billings,Arena,US DOLLAR,Police Productions,Country,8632.0,596920.0,8632.0,100%,45.0,150.0,69.15,9,5
2024-09-07,Bill Maher,,,,,,,,,,,,,,,,,,,,,,,,,,,,2024.0,0.0,0.0,,1,,Cobb Energy Performing Arts Centre,Atlanta,Georgia,United States,Atlanta,Auditorium / Theatre,US DOLLAR,Live Nation,Comedy,2198.0,185942.5,2667.0,82%,44.5,124.5,84.6,9,5
2024-09-07,"""Causeway Card Show""",,,,,,,,,,,,,,,,,,,,,,,,,,,,2024.0,0.0,0.0,,1,,Big Night Live,Boston,Massachusetts,United States,Boston (Manchester) ,Club,US DOLLAR,"(In-House Promotion), Big Night Entertainment Group",Family Entertainment,547.0,4285.0,1400.0,39%,5.0,10.0,7.83,9,5
2024-09-07,Koe Wetzel,,,,,,,,,,,,,,,,,,,,,,,,,,,,2024.0,8110055.0,0.0,8110055.0,1,,Koka Booth Amphitheatre,Cary,North Carolina,United States,Raleigh-Durham (Fayetteville) ,Amphitheatre,US DOLLAR,AEG Presents,"Americana, Country, Pop / Rock",6828.0,333230.0,6933.0,98%,40.0,100.0,48.8,9,5
2024-09-07,Rod Stewart,Rod Stewart,"['mellow gold', 'soft rock']",4944624.0,73.0,Rod Stewart,UCm09uYWfEygr5gWjDm9xmUA,Rod Stewart,"The Rod Stewart channel is the official YouTube home of musician and songwriter Sir Rod Stewart, whose unmistakable voice has graced the world with an oeuvre than spans 5 decades.  Sir Rod Stewart is one of the best-selling music artists of all time, selling more than 200 million records worldwide during a stellar career that includes a staggering nine #1 albums and 31 Top 10 singles in the U.K. plus, 16 top 10 albums and 26 Top 10 singles in the US such as “Maggie May”, “Tonight’s The Night (Gonna Be Alright)”, and “Sailing”. We are proud to present Rod Stewart’s entire catalogue including the more than 50 music videos that trace an incomparable career and a Rock ‘N Roll story that continues to unfold. 

🔔 Subscribe to the channel today and ring the bell to stay up to date with the latest from Rod Stewart.
",2017-08-15T23:32:01Z,3330632600.0,4180000.0,113.0,18160.0,754.0,525.0,1232.0,1129.0,1410.0,2558.0,2127.0,2713.0,1399.0,1320.0,1462.0,1122.0,409.0,42.7,2024.0,10555795.0,0.0,10555795.0,1,,Mohegan Sun Arena,Uncasville,Connecticut,United States,Hartford-New Haven,Arena,US DOLLAR,(In-House Promotion),Pop / Rock,6384.0,1108388.0,6975.0,91%,79.5,299.5,173.62,9,5
2024-09-07,Topanga Hills Mafia,,,,,,,,,,,,,,,,,,,,,,,,,,,,2024.0,0.0,0.0,,1,,Shrine at Foxwoods,Mashantucket,Connecticut,United States,Hartford-New Haven,Club,US DOLLAR,"(In-House Promotion), Big Night Entertainment Group",Dance / Electronic,60.0,520.0,800.0,7%,7.5,20.0,8.67,9,5
2024-09-07,Marty Stuart and His Fabulous Superlatives,,,,,,,,,,,,,,,,,,,,,,,,,,,,2024.0,0.0,0.0,,1,,Blue Gate Performing Arts Center,Shipshewana,Indiana,United States,South Bend-Elkhart,Auditorium / Theatre,US DOLLAR,"(In-House Promotion), Blue Gate Theatre",Country,1065.0,64096.75,1470.0,72%,34.95,79.95,60.18,9,5
2024-09-07,Flor Bertotti,,,,,,,,,,,,,,,,,,,,,,,,,,,,2024.0,0.0,0.0,,1,,James L. Knight Center,Miami,Florida,United States,Miami-Ft. Lauderdale,Auditorium / Theatre,US DOLLAR,Blueteam Dream Makers LLC,Jazz,4049.0,399594.0,4609.0,87%,48.0,375.0,98.69,9,5
2024-09-07,Peter Cat Recording Co.,Peter Cat Recording Co.,"['indian electronic', 'indian indie', 'new delhi indie']",197223.0,54.0,Peter Cat Recording Co.,UCMyWfOzSUb1qFxOLEcZGt0w,Peter Cat Recording Co.,,2010-05-28T18:38:39Z,8066108.0,40900.0,18.0,665945.0,31428.0,26801.0,29526.0,46290.0,66772.0,158449.0,86950.0,68883.0,36479.0,32331.0,48205.0,22488.0,11343.0,32.9,2024.0,0.0,0.0,,1,,Citizens House of Blues Boston,Boston,Massachusetts,United States,Boston (Manchester) ,Club,US DOLLAR,Crossroads Presents,Pop / Rock,1426.0,41645.0,2425.0,58%,15.0,49.5,29.2,9,5
2024-09-07,Costa,,,,,,,,,,,,,,,,,,,,,,,,,,,,2024.0,0.0,0.0,,1,,Mémoire At Encore Boston Harbor,Everett,Massachusetts,United States,Boston (Manchester) ,Club,US DOLLAR,"(In-House Promotion), Big Night Entertainment Group",Dance / Electronic,135.0,2580.0,600.0,22%,15.0,100.0,19.11,9,5
2024-09-06,Classic Albums Live,,,,,,,,,,,,,,,,,,,,,,,,,,,,2024.0,0.0,0.0,,1,,Bilheimer Capitol Theatre,Clearwater,Florida,United States,Tampa-St. Petersburg (Sarasota) ,Club,US DOLLAR,Ruth Eckerd Hall Presents,"Pop / Rock, Tribute Acts",546.0,23096.0,650.0,84%,35.0,50.0,42.3,9,4
2024-09-06,Liverpool Legends “Beatles Experience!”,,,,,,,,,,,,,,,,,,,,,,,,,,,,2024.0,0.0,0.0,,1,,Stafford Centre,Stafford,Texas,United States,Houston,Auditorium / Theatre,US DOLLAR,Liverpool Legends,Tribute Acts,450.0,25215.0,1155.0,38%,35.0,80.0,56.03,9,4
2024-09-06,Jelly Roll,,,,,,,,,,,,,,,,,,,,,,,,,,,,2024.0,0.0,0.0,,1,,Crypto.com Arena,Los Angeles,California,United States,Los Angeles,Arena,US DOLLAR,Live Nation,"Country, Rap / HipHop",13118.0,1182740.0,13118.0,100%,39.5,179.5,90.16,9,4
2024-09-06,Creed,Creed,"['alternative metal', 'nu metal', 'post-grunge', 'rock']",3527070.0,74.0,Creed,UCP-tFf_VMQzhyeKMONL1KvQ,Creed,Subscribe to Creed's Official Youtube Channel to see the latest videos from the band!,2009-03-30T21:30:11Z,1530589615.0,1870000.0,145.0,138868.0,11471.0,11950.0,11578.0,12821.0,10402.0,21305.0,18597.0,14864.0,7263.0,6130.0,7435.0,4095.0,957.0,30.2,2024.0,8501966.0,0.0,8501966.0,1,"3 Doors Down, Finger Eleven",Utah First Credit Union Amphitheatre,West Valley City,Utah,United States,Salt Lake City,Amphitheatre,US DOLLAR,Live Nation,Pop / Rock,19691.0,1239787.0,19691.0,100%,39.5,159.5,62.96,9,4
2024-09-06,Cody Johnson,,,,,,,,,,,,,,,,,,,,,,,,,,,,2024.0,10274474.0,0.0,10274474.0,1,"Wade Bowen, Ashland Craft",Summit Arena at The Monument,Rapid City,South Dakota,United States,Rapid City,Arena,US DOLLAR,Police Productions,Country,6129.0,447380.0,7085.0,86%,45.0,150.0,72.99,9,4
2024-09-06,Chad Perrone,,,,,,,,,,,,,,,,,,,,,,,,,,,,2024.0,0.0,0.0,,1,Lisa Piccirillo,Haymarket Lounge @ City Winery Boston,Boston,Massachusetts,United States,Boston (Manchester) ,Club,US DOLLAR,"(In-House Productions) / City Winery, (In-House Promotion)",Folk,66.0,1450.0,75.0,88%,20.0,30.0,21.97,9,4
2024-09-06,Tiësto,,,,,,,,,,,,,,,,,,,,,,,,,,,,2024.0,49305374.0,0.0,49305374.0,1,,Big Night Live,Boston,Massachusetts,United States,Boston (Manchester) ,Club,US DOLLAR,"(In-House Promotion), Big Night Entertainment Group",Dance / Electronic,1369.0,102675.0,1400.0,97%,75.0,75.0,75.0,9,4
2024-09-06,Charly Jordan,,,,,,,,,,,,,,,,,,,,,,,,,,,,2024.0,0.0,0.0,,1,,The Grand,Boston,Massachusetts,United States,Boston (Manchester) ,Club,US DOLLAR,"(In-House Promotion), Big Night Entertainment Group",Dance / Electronic,46.0,1080.0,600.0,7%,15.0,100.0,23.48,9,4
2024-09-06,Topanga Hills Mafia,,,,,,,,,,,,,,,,,,,,,,,,,,,,2024.0,0.0,0.0,,1,,Mémoire At Encore Boston Harbor,Everett,Massachusetts,United States,Boston (Manchester) ,Club,US DOLLAR,"(In-House Promotion), Big Night Entertainment Group",Dance / Electronic,51.0,860.0,600.0,8%,15.0,20.0,16.86,9,4
2024-09-06,Who's Bad - The Ultimate Michael Jackson Tribute,,,,,,,,,,,,,,,,,,,,,,,,,,,,2024.0,0.0,0.0,,1,,City Winery Atlanta,Atlanta,Georgia,United States,Atlanta,Club,US DOLLAR,(In-House Promotion),,244.0,10870.0,312.0,78%,35.0,50.0,44.55,9,4
2024-09-06,Black Jacket Symphony,,,,,,,,,,,,,,,,,,,,,,,,,,,,2024.0,0.0,0.0,,1,,Charleston Music Hall,Charleston,South Carolina,United States,"Charleston, SC ",Auditorium / Theatre,US DOLLAR,"Emporium Presents - Seattle, NS2",Tribute Acts,745.0,29800.0,933.0,79%,40.0,40.0,40.0,9,4
2024-09-06,Rodney Carrington,,,,,,,,,,,,,,,,,,,,,,,,,,,,2024.0,0.0,0.0,,1,,River City Casino & Hotel,St. Louis,Missouri,United States,St. Louis,Casino,US DOLLAR,(In-House Promotion),Comedy,766.0,39685.0,980.0,78%,30.0,65.0,51.81,9,4
2024-09-06,Rodney Carrington,,,,,,,,,,,,,,,,,,,,,,,,,,,,2024.0,0.0,0.0,,1,,River City Casino & Hotel,St. Louis,Missouri,United States,St. Louis,Casino,US DOLLAR,(In-House Promotion),Comedy,766.0,39685.0,980.0,78%,30.0,65.0,51.81,9,4
2024-09-06,Rodney Carrington,,,,,,,,,,,,,,,,,,,,,,,,,,,,2024.0,0.0,0.0,,1,,River City Casino & Hotel,St. Louis,Missouri,United States,St. Louis,Casino,US DOLLAR,(In-House Promotion),Comedy,703.0,35610.0,980.0,71%,30.0,65.0,50.65,9,4
2024-09-06,Rodney Carrington,,,,,,,,,,,,,,,,,,,,,,,,,,,,2024.0,0.0,0.0,,1,,River City Casino & Hotel,St. Louis,Missouri,United States,St. Louis,Casino,US DOLLAR,(In-House Promotion),Comedy,703.0,35610.0,980.0,71%,30.0,65.0,50.65,9,4
2024-09-06,Koe Wetzel,,,,,,,,,,,,,,,,,,,,,,,,,,,,2024.0,8110055.0,0.0,8110055.0,1,,Colonial Life Arena,Columbia,South Carolina,United States,"Columbia, SC ",Arena,US DOLLAR,AEG Presents,"Americana, Country, Pop / Rock",12230.0,647265.0,12363.0,98%,25.0,150.0,52.92,9,4
2024-09-06,Jon Batiste ,,,,,,,,,,,,,,,,,,,,,,,,,,,,2024.0,0.0,0.0,,2,,Radio City Music Hall,New York,New York,United States,New York,Auditorium / Theatre,US DOLLAR,"AEG Presents, The Bowery Presents",Jazz,5867.0,536051.19,5868.0,99%,49.5,175.0,91.36,9,4
2024-09-06,Bone Thugs-N-Harmony,,,,,,,,,,,,,,,,,,,,,,,,,,,,2024.0,5598530.0,0.0,5598530.0,1,,The Event Center at Hollywood Casino,Charles Town,West Virginia,United States,"Washington, D.C. (Hagerstown) ",Auditorium / Theatre,US DOLLAR,(In-House Promotion),Rap / HipHop,757.0,34128.75,1475.0,51%,45.0,45.0,45.08,9,4
2024-09-06,Don Omar,,,,,,,,,,,,,,,,,,,,,,,,,,,,2024.0,38230196.0,0.0,38230196.0,1,,Amalie Arena,Tampa,Florida,United States,Tampa-St. Petersburg (Sarasota) ,Arena,US DOLLAR,Cárdenas Marketing Network (CMN),"Latin, Rap / HipHop",12047.0,1229211.0,12047.0,100%,41.0,181.0,102.03,9,4
2024-09-06,Chayanne,,,,,,,,,,,,,,,,,,,,,,,,,,,,2024.0,13426100.0,0.0,13426100.0,1,,Golden 1 Center,Sacramento,California,United States,Sacramento-Stockton-Modesto ,Arena,US DOLLAR,Cárdenas Marketing Network (CMN),Latin,7802.0,1010534.5,10147.0,76%,52.0,195.0,129.52,9,4
2024-09-06,Ricky Skaggs,,,,,,,,,,,,,,,,,,,,,,,,,,,,2024.0,501445.0,0.0,501445.0,1,,Blue Gate Performing Arts Center,Shipshewana,Indiana,United States,South Bend-Elkhart,Auditorium / Theatre,US DOLLAR,"(In-House Promotion), Blue Gate Theatre",Country,1338.0,64943.1,1470.0,91%,29.95,79.95,48.54,9,4
2024-09-06,La India Yuridia,,,,,,,,,,,,,,,,,,,,,,,,,,,,2024.0,0.0,0.0,,1,,James L. Knight Center,Miami,Florida,United States,Miami-Ft. Lauderdale,Auditorium / Theatre,US DOLLAR,Illusion Touring Entertainment,Comedy,622.0,62318.0,1627.0,38%,59.0,159.0,100.19,9,4
2024-09-05,Tom Jones,Tom Jones,"['adult standards', 'british invasion']",1016787.0,66.0,Tom Jones,UCy2JIPsxsCoDK3M1BcEVGGA,Tom Jones,The official Sir Tom Jones YouTube channel,2009-11-19T15:12:28Z,393602880.0,670000.0,148.0,18160.0,754.0,525.0,1232.0,1129.0,1410.0,2558.0,2127.0,2713.0,1399.0,1320.0,1462.0,1122.0,409.0,42.7,2024.0,6527258.0,0.0,6527258.0,1,,Mohegan Sun Arena,Uncasville,Connecticut,United States,Hartford-New Haven,Arena,US DOLLAR,(In-House Promotion),Pop / Rock,6631.0,609065.0,7220.0,91%,49.5,129.5,91.85,9,3
2024-09-05,"""K-Pop Club Night""","""K-Pop Club Night""","['k-pop', 'k-pop girl group']",9156939.0,82.0,"""K-Pop Club Night""",UCSSEYmHc2HGnFWwHhRXY5kA,P Su,,2023-04-14T11:34:17.558153Z,16.0,0.0,2.0,665945.0,31428.0,26801.0,29526.0,46290.0,66772.0,158449.0,86950.0,68883.0,36479.0,32331.0,48205.0,22488.0,11343.0,32.9,2024.0,0.0,0.0,,1,,Big Night Live,Boston,Massachusetts,United States,Boston (Manchester) ,Club,US DOLLAR,"(In-House Promotion), Big Night Entertainment Group",Pop / Rock,361.0,9113.0,1600.0,22%,22.0,35.0,25.24,9,3
2024-09-05,Sunny War,,,,,,,,,,,,,,,,,,,,,,,,,,,,2024.0,105378.0,0.0,105378.0,1,,Narrows Center for the Arts,Fall River,Massachusetts,United States,Providence-New Bedford,Club,US DOLLAR,(In-House Promotion),"Blues, Folk, Pop / Rock",62.0,1574.0,430.0,14%,25.0,27.0,25.39,9,3
2024-09-05,Judith Hill,Judith Hill,['neo soul'],60505.0,40.0,Judith Hill,UC_yaY0kddCZZLfLQKOjhj3w,Judith Hill,New album ‘Letters From a Black Widow’ out NOW! Get it below ⬇️,2006-11-11T08:05:44Z,5348364.0,44700.0,64.0,494838.0,26302.0,25123.0,21482.0,30442.0,48021.0,108051.0,70757.0,56159.0,25056.0,23988.0,35796.0,16481.0,7180.0,33.6,2024.0,92916.0,0.0,92916.0,1,,City Winery Atlanta,Atlanta,Georgia,United States,Atlanta,Club,US DOLLAR,"(In-House Productions) / City Winery, (In-House Promotion)",Pop / Rock,146.0,5607.0,312.0,46%,30.0,45.0,38.4,9,3
2024-09-05,Mac McAnally,,,,,,,,,,,,,,,,,,,,,,,,,,,,2024.0,0.0,0.0,,1,,Lexington Opera House,Lexington,Kentucky,United States,Lexington,Auditorium / Theatre,US DOLLAR,NS2,Country,860.0,64247.5,956.0,89%,49.5,89.5,74.71,9,3
