2024-08-24,"""EMO Night Brooklyn""",,,,,,,,,,,,,,,,,,,,,,,,,,,,2024.0,0.0,0.0,,1,,Music Farm,Charleston,South Carolina,United States,"Charleston, SC ",Club,US DOLLAR,"Live Nation, NS2",Dance / Electronic,486.0,8878.0,675.0,72%,15.0,20.0,18.27,8,5
2024-08-24,Ty Myers,,,,,,,,,,,,,,,,,,,,,,,,,,,,2024.0,0.0,0.0,,1,,Floore's Country Store,Helotes,Texas,United States,San Antonio,Amphitheatre,US DOLLAR,(In-House Promotion),Country,800.0,9600.0,800.0,100%,12.0,15.0,12.0,8,5
2024-08-24,Sam Feldt,,,,,,,,,,,,,,,,,,,,,,,,,,,,2024.0,0.0,0.0,,1,,Big Night Live,Boston,Massachusetts,United States,Boston (Manchester) ,Club,US DOLLAR,"(In-House Promotion), Big Night Entertainment Group",Dance / Electronic,276.0,5140.0,1400.0,19%,15.0,20.0,18.62,8,5
2024-08-24,DJ JD,,,,,,,,,,,,,,,,,,,,,,,,,,,,2024.0,0.0,0.0,,1,,Shrine at Foxwoods,Mashantucket,Connecticut,United States,Hartford-New Haven,Club,US DOLLAR,"(In-House Promotion), Big Night Entertainment Group",,47.0,430.0,800.0,5%,7.5,20.0,9.15,8,5
2024-08-24,DJ Priz,,,,,,,,,,,,,,,,,,,,,,,,,,,,2024.0,0.0,0.0,,1,,Mémoire At Encore Boston Harbor,Everett,Massachusetts,United States,Boston (Manchester) ,Club,US DOLLAR,"(In-House Promotion), Big Night Entertainment Group",,87.0,1880.0,600.0,14%,15.0,100.0,21.61,8,5
2024-08-24,Costa,,,,,,,,,,,,,,,,,,,,,,,,,,,,2024.0,0.0,0.0,,1,,The Grand,Boston,Massachusetts,United States,Boston (Manchester) ,Club,US DOLLAR,"(In-House Promotion), Big Night Entertainment Group",Dance / Electronic,57.0,1100.0,600.0,9%,15.0,20.0,19.3,8,5
2024-08-24,Ian McConnell,Ian McConnell,[],78169.0,47.0,Ian McConnell,UCIpTsjEVk1fRXmYiL7wlRww,Ian McConnell,"Ian McConnell performs actions that have consequences. There is a very small gravitational field around him at all times. He prefers to get 8.5 hours of sleep if he can swing it, but is an experienced napper and can compensate for accumulated sleep debt during the day.

",2016-12-03T18:39:27Z,6109542.0,40500.0,297.0,851036.0,36577.0,30244.0,31147.0,30060.0,42665.0,186435.0,138038.0,112681.0,51743.0,49327.0,79893.0,39583.0,22643.0,39.3,2024.0,248582.0,0.0,248582.0,1,,Bottom Of The Hill,San Francisco,California,United States,San Francisco-Oakland-San Jose,Club,US DOLLAR,(In-House Promotion),Pop / Rock,98.0,1554.0,325.0,30%,15.0,18.0,15.86,8,5
2024-08-24,Start Making Sense - Trib. to Talking Heads,,,,,,,,,,,,,,,,,,,,,,,,,,,,2024.0,0.0,0.0,,1,,The Range Mason,Mason,New Hampshire,United States,,Outdoor Venues,US DOLLAR,(In-House Promotion),Tribute Acts,496.0,16344.0,1000.0,49%,28.0,35.0,32.95,8,5
2024-08-24,hololive English 2nd Concert - Breaking Dimensions,hololive English 2nd Concert - Breaking Dimensions,[],10015.0,36.0,hololive English 2nd Concert - Breaking Dimensions,UCotXwY6s8pWmuWd_snKYjhg,hololive English,"■hololive English
hololive English is an all-girl VTuber group under COVER Corporation aimed at the English-speaking audience. Their activities include live streaming on platforms such as YouTube and interacting with fans on Twitter. The talents perform using intricate 2D and 3D avatars provided by the company.
・hololive English Official Twitter: https://twitter.com/hololive_En
・hololive English Official Reddit: https://www.reddit.com/r/Hololive/

■COVER Corporation
COVER Corporation is a tech startup which blends together content creation with VR and AR technologies to carry its vision of delivering the culture of virtual streaming to the world.
・Corporate Website: http://cover-corp.com
・Employment Page: https://www.wantedly.com/companies/cover-corp

COVER Corporation’s Press Release History: https://prtimes.jp/main/html/searchrlp/company_id/30268",2020-09-07T13:42:23.800696Z,98007042.0,788000.0,237.0,2679620.0,183126.0,163609.0,165401.0,145554.0,161329.0,477420.0,381113.0,313167.0,154797.0,145520.0,225220.0,112649.0,50715.0,35.9,2024.0,0.0,0.0,,1,,Kings Theatre,Brooklyn,New York,United States,New York,Auditorium / Theatre,US DOLLAR,Live Nation,Pop / Rock,2905.0,340210.0,2995.0,96%,85.0,135.0,117.11,8,5
2024-08-24,Paul Thorn,,,,,,,,,,,,,,,,,,,,,,,,,,,,2024.0,52212.0,0.0,52212.0,1,,Knuckleheads,Kansas City,Missouri,United States,Kansas City,Club,US DOLLAR,(In-House Promotion),"Americana, Blues, Pop / Rock",357.0,8900.0,450.0,79%,25.0,25.0,24.93,8,5
2024-08-24,The Robert Cray Band,,,,,,,,,,,,,,,,,,,,,,,,,,,,2024.0,399817.0,0.0,399817.0,1,Zach Day,Paramount Theatre Centre & Ballroom,Anderson,Indiana,United States,Indianapolis,Auditorium / Theatre,US DOLLAR,(In-House Promotion),Blues,661.0,27420.0,1090.0,60%,29.0,89.0,41.48,8,5
2024-08-24,Cain,,,,,,,,,,,,,,,,,,,,,,,,,,,,2024.0,1500833.0,0.0,1500833.0,1,Caleb & John,Calvary Church,Souderton,Pennsylvania,United States,,Auditorium / Theatre,US DOLLAR,Awakening Events,,1444.0,44742.0,1444.0,100%,26.0,39.0,30.98,8,5
2024-08-24,Boyz II Men,,,,,,,,,,,,,,,,,,,,,,,,,,,,2024.0,5907521.0,0.0,5907521.0,1,,The Chelsea,Las Vegas,Nevada,United States,Las Vegas,Club,US DOLLAR,Live Nation,RB / Soul,2278.0,376379.0,2278.0,100%,75.21,380.41,165.22,8,5
2024-08-24,Koe Wetzel,,,,,,,,,,,,,,,,,,,,,,,,,,,,2024.0,7109875.0,0.0,7109875.0,1,,The Anthem,Washington,District of Columbia,United States,"Washington, D.C. (Hagerstown) ",Auditorium / Theatre,US DOLLAR,AEG Presents,"Americana, Country, Pop / Rock",5912.0,313844.0,6019.0,98%,49.5,89.5,53.09,8,5
2024-08-24,mike.,mike.,"['indie pop rap', 'rhode island rap']",602756.0,64.0,mike.,UCiXfXIX2s6MKt4N2KkBdg2Q,MIKE,,2012-05-17T22:45:11Z,15639992.0,67800.0,62.0,303843.0,13756.0,11443.0,12086.0,24275.0,34325.0,63669.0,36560.0,27898.0,16153.0,17862.0,26670.0,12709.0,6437.0,33.5,2024.0,0.0,0.0,,1,,Stage AE / Outdoor,Pittsburgh,Pennsylvania,United States,Pittsburgh,Outdoor Venues,US DOLLAR,"(In-House Promotion), AEG Presents, PromoWest Productions",Pop / Rock,3229.0,114488.75,4500.0,71%,35.0,85.0,35.46,8,5
2024-08-24,"""The Emo Night Tour""",,,,,,,,,,,,,,,,,,,,,,,,,,,,2024.0,0.0,0.0,,1,,Newport Music Hall,Columbus,Ohio,United States,"Columbus, OH ",Auditorium / Theatre,US DOLLAR,"(In-House Promotion), AEG Presents, PromoWest Productions",Multi-Genre,346.0,7388.0,1300.0,26%,18.0,30.0,21.35,8,5
2024-08-24,Courtney From Work,,,,,,,,,,,,,,,,,,,,,,,,,,,,2024.0,0.0,0.0,,1,"Light Sleeper, The Methmatics, Space Kid",The Basement,Columbus,Ohio,United States,"Columbus, OH ",Club,US DOLLAR,"(In-House Promotion), AEG Presents, PromoWest Productions",,95.0,1326.0,300.0,31%,12.0,15.0,13.96,8,5
2024-08-24,King 810,King 810,['nu-metalcore'],120179.0,46.0,King 810,UCHWJD3niQpHco1UjPYW0epg,KING 810,"King 810 is an American nu metal band from Flint, Michigan. Formed in 2007, in a town renowned for its crime and poverty their sound blends everything from crushing nu-metal riffs and twisted alt-rock, to experimental hip-hop, electronica and dark jazz, standing proudly apart from the common modern metal herd.
King 810 punctured the mainstream consciousness in 2012, when their “Midwest Monsters” EP earned them a deal with Roadrunner Records. “Memoirs Of A Murderer” the band’s full-length debut emerged to great acclaim later that year.
Breaking new ground in 2015 with mixtape “Midwest Monsters 2”:
The following year, King 810 released the audacious “La Petite Mort Or A Conversation With God”. The extraordinary, visceral poetry and prose of frontman David Gunn transmuted into the acoustic respite of the “Queen” EP before King 810 cut their big label ties embracing independence with 2018’s gleaming, esoteric “Suicide King” album. 
",2014-03-25T22:24:35Z,63182891.0,138000.0,274.0,681088.0,46030.0,47319.0,48658.0,45261.0,47836.0,106599.0,95510.0,77973.0,38985.0,37830.0,54727.0,25642.0,8718.0,34.9,2024.0,176944.0,0.0,176944.0,1,,89th Street - OKC,Oklahoma City,Oklahoma,United States,Oklahoma City,Club,US DOLLAR,(In-House Promotion),Pop / Rock,160.0,3560.0,300.0,53%,17.0,27.0,22.25,8,5
2024-08-23,Kenny Chesney,,,,,,,,,,,,,,,,,,,,,,,,,,,,2024.0,0.0,0.0,,3,"Zac Brown Band, Megan Moroney, Uncle Kracker",Gillette Stadium,Foxborough,Massachusetts,United States,Boston (Manchester) ,Stadium,US DOLLAR,"AEG Presents, Messina Touring Group",Country,61074.0,8769445.33,61075.0,99%,60.0,345.0,143.59,8,4
2024-08-23,Imagine Dragons,Imagine Dragons,"['modern rock', 'pop', 'rock']",54802787.0,89.0,Imagine Dragons,UCT9zcQNlyht7fRlcjmflRSA,ImagineDragons,"LOOM. our sixth studio album. Listen and purchase now: https://imaginedragons.lnk.to/loom 
Shop LOOM merch & music products: https://imaginedragons.lnk.to/loomstore 
Get the target exclusive orange vinyl: https://imaginedragons.lnk.to/loom/target 
Get the walmart exclusive pink vinyl: https://imaginedragons.lnk.to/loom/walmart 
Get the indie exclusive curacao vinyl: https://imaginedragons.lnk.to/LOOM/recordstoreday
",2009-08-03T09:09:31Z,19484800917.0,32000000.0,202.0,106600.0,5894.0,5645.0,6741.0,6986.0,6802.0,15497.0,14767.0,13239.0,7417.0,6253.0,9648.0,5179.0,2532.0,38.8,2024.0,62318979.0,0.0,62318979.0,1,,Merriweather Post Pavilion,Columbia,Maryland,United States,"Washington, D.C. (Hagerstown) ",Amphitheatre,US DOLLAR,Live Nation,Pop / Rock,15000.0,1503448.0,15000.0,100%,49.5,209.5,100.23,8,4
2024-08-23,Bachman-Turner Overdrive,,,,,,,,,,,,,,,,,,,,,,,,,,,,2024.0,0.0,0.0,,1,,Center Stage at MGM Northfield Park,Northfield,Ohio,United States,Cleveland-Akron (Canton) ,Club,US DOLLAR,"Live Nation, MGM Resorts International",,1250.0,98404.0,1636.0,76%,57.5,125.0,78.72,8,4
2024-08-23,"Chicago, Earth, Wind & Fire",,,,,,,,,,,,,,,,,,,,,,,,,,,,2024.0,0.0,0.0,,1,,Dickies Arena,Fort Worth,Texas,United States,Dallas-Ft. Worth,Arena,US DOLLAR,Live Nation,"Pop / Rock, RB / Soul",11562.0,1143213.0,11805.0,97%,39.5,499.5,98.88,8,4
2024-08-23,Donavon Frankenreiter,Donavon Frankenreiter,['neo mellow'],393904.0,57.0,Donavon Frankenreiter,UCkBlhB6latUjr_1sW6HiZoQ,Donavon Frankenreiter,"My new album, Get Outta Your Mind, is out now ❤️",2006-11-01T20:02:33Z,30121273.0,37800.0,108.0,93638.0,5432.0,4626.0,5976.0,5026.0,5667.0,14445.0,12345.0,12731.0,5880.0,6703.0,8354.0,4349.0,2104.0,39.2,2024.0,1336196.0,0.0,1336196.0,1,,Narrows Center for the Arts,Fall River,Massachusetts,United States,Providence-New Bedford,Club,US DOLLAR,(In-House Promotion),Pop / Rock,255.0,10295.0,430.0,59%,40.0,45.0,40.37,8,4
2024-08-23,Creed,Creed,"['alternative metal', 'nu metal', 'post-grunge', 'rock']",3527070.0,74.0,Creed,UCP-tFf_VMQzhyeKMONL1KvQ,Creed,Subscribe to Creed's Official Youtube Channel to see the latest videos from the band!,2009-03-30T21:30:11Z,1530589615.0,1870000.0,145.0,14682.0,555.0,545.0,860.0,1122.0,998.0,1794.0,1310.0,2511.0,700.0,1581.0,1390.0,836.0,480.0,46.0,2024.0,8169529.0,0.0,8169529.0,1,"3 Doors Down, Finger Eleven",Hersheypark Stadium,Hershey,Pennsylvania,United States,Harrisburg-Lancaster-Lebanon-York ,Stadium,US DOLLAR,Live Nation,Pop / Rock,29171.0,2209858.0,29171.0,100%,39.5,225.0,75.76,8,4
2024-08-23,New Kids On The Block,New Kids On The Block,['boy band'],830230.0,57.0,New Kids On The Block,UCS9lJwUApBCwvyC36COgAbQ,New Kids on the Block,"Our first ever Las Vegas Residency: THE RIGHT STUFF is coming to Dolby Live at Park MGM in 2025 & 2026.  Get tickets NKOTB.com/Vegas
",2008-01-28T17:23:02Z,665056610.0,998000.0,300.0,902449.0,61282.0,54538.0,53027.0,58165.0,76599.0,184989.0,122525.0,99023.0,48033.0,47363.0,60473.0,25427.0,11005.0,32.7,2024.0,0.0,0.0,,1,"Paula Abdul, DJ Jazzy Jeff",Nationwide Arena,Columbus,Ohio,United States,"Columbus, OH ",Arena,US DOLLAR,Live Nation,Pop / Rock,11396.0,1112704.0,12776.0,89%,29.95,499.95,97.64,8,4
2024-08-23,Get The Led Out,,,,,,,,,,,,,,,,,,,,,,,,,,,,2024.0,0.0,0.0,,1,,Indian Ranch,Webster,Massachusetts,United States,Boston (Manchester) ,Theme Park,US DOLLAR,Kendall Booking,Tribute Acts,2381.0,82025.0,3046.0,78%,27.5,27.5,34.45,8,4
2024-08-23,Fistful of Ballers,,,,,,,,,,,,,,,,,,,,,,,,,,,,2024.0,0.0,0.0,,1,,City Winery Pittsburgh,Pittsburgh,Pennsylvania,United States,Pittsburgh,Club,US DOLLAR,(In-House Productions) / City Winery,Rap / HipHop,146.0,3670.0,220.0,66%,20.0,30.0,25.14,8,4
2024-08-23,Jon Pardi,,,,,,,,,,,,,,,,,,,,,,,,,,,,2024.0,10063407.0,0.0,10063407.0,1,The Castellows,Lake Tahoe Outdoor Arena At Harveys,Stateline,Nevada,United States,Reno,Amphitheatre,US DOLLAR,Another Planet Entertainment,Country,6657.0,805468.82,6657.0,100%,69.5,149.5,121.0,8,4
2024-08-23,End Of The Line: A Tribute To The Allman Brothers Band,,,,,,,,,,,,,,,,,,,,,,,,,,,,2024.0,0.0,0.0,,1,,City Winery Nashville,Nashville,Tennessee,United States,Nashville,Club,US DOLLAR,"(In-House Productions) / City Winery, (In-House Promotion)",Tribute Acts,244.0,14485.0,314.0,77%,50.0,65.0,59.36,8,4
2024-08-23,"Iration, Pepper",,,,,,,,,,,,,,,,,,,,,,,,,,,,2024.0,0.0,0.0,,2,"Artikal Sound System, Denm",Pacific Amphitheatre,Costa Mesa,California,United States,Los Angeles,Amphitheatre,US DOLLAR,(In-House Promotion),"Pop / Rock, World",4656.0,246030.25,7926.0,58%,35.0,75.0,52.84,8,4
2024-08-23,"Wussy presents ""Little Mx. WUSSY Pageant""",,,,,,,,,,,,,,,,,,,,,,,,,,,,2024.0,0.0,0.0,,1,,City Winery Atlanta,Atlanta,Georgia,United States,Atlanta,Club,US DOLLAR,"(In-House Productions) / City Winery, (In-House Promotion)",Family Entertainment,69.0,1790.0,312.0,22%,15.0,30.0,25.94,8,4
2024-08-23,Zach Rushing,,,,,,,,,,,,,,,,,,,,,,,,,,,,2024.0,0.0,0.0,,1,Officer Eudy,Marion Cultural and Civic Center,Marion,Illinois,United States,Paducah-Cape Girardeau-Harrisburg ,Auditorium / Theatre,US DOLLAR,Mad Hatter Shows,Comedy,798.0,30770.0,800.0,99%,25.0,50.0,38.56,8,4
2024-08-23,"""The Taylor Party""",,,,,,,,,,,,,,,,,,,,,,,,,,,,2024.0,0.0,0.0,,1,,Big Night Live,Boston,Massachusetts,United States,Boston (Manchester) ,Club,US DOLLAR,"(In-House Promotion), Big Night Entertainment Group",Multi-Genre,627.0,11411.0,1600.0,39%,13.5,30.0,18.2,8,4
2024-08-23,Holly Bruce,Holly Bruce,[],75.0,0.0,Holly Bruce,UCqeV63ag0V318qk9mrOnb-w,Holly Bruce,"Holly Bruce's musical journey is deeply rooted in her passion for both music & healing arts. From an early age, she has crafted melodies by ear, honing her skills while studying Music Composition at the San Francisco Conservatory. Today, Bruce's evocative vocals & emotive lyrics convey a wide range of emotional depth, drawing listeners into her own healing process & journey. She is actively exploring opportunities to place her music in television & film, aiming to expand her reach & impact. The upcoming album ""Love Remains"" promises to be a compelling compilation of poetic lyricism, highlighting a decade-long journey of love, grief, recovery & empowerment. As anticipation builds for the release of ""Love Remains,"" Holly Bruce continues to captivate audiences with her authentic storytelling & soulful melodies. With ""What I Know,"" she invites listeners on a transformative journey of self-discovery, solidifying her status as one of Nashville's most promising talents. ~ Marilyn @Present PR",2015-07-22T03:48:22Z,8690.0,86.0,69.0,684103.0,44042.0,37677.0,36449.0,38591.0,49823.0,139881.0,97298.0,77338.0,40930.0,35587.0,53657.0,23974.0,8856.0,34.6,2024.0,0.0,0.0,,1,,The Lounge @ City Winery Nashville,Nashville,Tennessee,United States,Nashville,Club,US DOLLAR,"(In-House Productions) / City Winery, (In-House Promotion)",Pop / Rock,68.0,1815.0,100.0,68%,25.0,30.0,26.69,8,4
2024-08-23,The Isaacs,,,,,,,,,,,,,,,,,,,,,,,,,,,,2024.0,0.0,0.0,,1,,Historic Paramount Theatre,Abilene,Texas,United States,Abilene-Sweetwater,Auditorium / Theatre,US DOLLAR,(In-House Promotion),Christian,333.0,18117.0,333.0,100%,29.0,69.0,54.41,8,4
2024-08-23,Costa,,,,,,,,,,,,,,,,,,,,,,,,,,,,2024.0,0.0,0.0,,1,,Mémoire At Encore Boston Harbor,Everett,Massachusetts,United States,Boston (Manchester) ,Club,US DOLLAR,"(In-House Promotion), Big Night Entertainment Group",Dance / Electronic,102.0,1780.0,600.0,17%,15.0,20.0,17.45,8,4
2024-08-23,The Breakbomb Project,,,,,,,,,,,,,,,,,,,,,,,,,,,,2024.0,0.0,0.0,,1,,The Grand,Boston,Massachusetts,United States,Boston (Manchester) ,Club,US DOLLAR,"(In-House Promotion), Big Night Entertainment Group",,65.0,1200.0,600.0,10%,15.0,20.0,18.46,8,4
2024-08-23,Mike Dawes,,,,,,,,,,,,,,,,,,,,,,,,,,,,2024.0,0.0,0.0,,1,Christie Lenée,The 04 Center,Austin,Texas,United States,Austin,Auditorium / Theatre,US DOLLAR,(In-House Promotion),Folk,164.0,5380.0,370.0,44%,25.0,35.0,32.8,8,4
2024-08-23,Mitchell Tenpenny,,,,,,,,,,,,,,,,,,,,,,,,,,,,2024.0,3573051.0,0.0,3573051.0,1,,Old National Events Plaza,Evansville,Indiana,United States,Evansville,Auditorium / Theatre,US DOLLAR,Pepper Entertainment,Country,911.0,32673.5,2111.0,43%,25.0,85.5,35.87,8,4
2024-08-23,King 810,King 810,['nu-metalcore'],120179.0,46.0,King 810,UCHWJD3niQpHco1UjPYW0epg,KING 810,"King 810 is an American nu metal band from Flint, Michigan. Formed in 2007, in a town renowned for its crime and poverty their sound blends everything from crushing nu-metal riffs and twisted alt-rock, to experimental hip-hop, electronica and dark jazz, standing proudly apart from the common modern metal herd.
King 810 punctured the mainstream consciousness in 2012, when their “Midwest Monsters” EP earned them a deal with Roadrunner Records. “Memoirs Of A Murderer” the band’s full-length debut emerged to great acclaim later that year.
Breaking new ground in 2015 with mixtape “Midwest Monsters 2”:
The following year, King 810 released the audacious “La Petite Mort Or A Conversation With God”. The extraordinary, visceral poetry and prose of frontman David Gunn transmuted into the acoustic respite of the “Queen” EP before King 810 cut their big label ties embracing independence with 2018’s gleaming, esoteric “Suicide King” album. 
",2014-03-25T22:24:35Z,63182891.0,138000.0,274.0,106440.0,6778.0,6793.0,6730.0,8152.0,9923.0,14941.0,12150.0,12334.0,5591.0,5711.0,9552.0,5095.0,2690.0,34.9,2024.0,176944.0,0.0,176944.0,1,,Brick's Bar & Grill,Tyler,Texas,United States,,Untyped Venue,US DOLLAR,(In-House Promotion),Pop / Rock,144.0,3310.0,400.0,36%,15.0,25.0,22.99,8,4
2024-08-23,Dark Star Orchestra,,,,,,,,,,,,,,,,,,,,,,,,,,,,2024.0,0.0,0.0,,1,,Thompson's Point,Portland,Maine,United States,Portland-Auburn,Amphitheatre,US DOLLAR,(In-House Promotion),Tribute Acts,3959.0,182275.0,6500.0,60%,45.0,55.0,46.04,8,4
2024-08-23,Steve Earle,,,,,,,,,,,,,,,,,,,,,,,,,,,,2024.0,3232049.0,0.0,3232049.0,1,Florence Dore,Barrymore Theatre,Madison,Wisconsin,United States,Madison,Auditorium / Theatre,US DOLLAR,True Endeavors,Americana,539.0,29055.0,755.0,71%,35.0,65.0,53.91,8,4
2024-08-23,"""Lost 80's Live""","""Lost 80's Live""",[],6872.0,45.0,"""Lost 80's Live""",UCjUiWfxDNbqzP67uW4lDiKQ,Lost 80's Live Tour,Official Youtube Account for the longest running 80's Retro tour of it's kind featuring the original vocalists live on one stage. www.lost80slive.com,2017-01-06T15:10:46Z,15921.0,104.0,17.0,1383987.0,74787.0,71510.0,73642.0,85005.0,108772.0,259461.0,200260.0,167783.0,78502.0,72717.0,111699.0,56938.0,22911.0,35.8,2024.0,0.0,8041071.0,8041071.0,1,"A Flock Of Seagulls, Wang Chung, The English Beat, The Vapors, Missing Persons, Stacey Q, The Escape Club, Musical Youth, Dramarama, Boys Don't Cry",Humphrey's Concerts By The Bay,San Diego,California,United States,San Diego,Club,US DOLLAR,(In-House Promotion),Pop / Rock,1078.0,118580.0,1428.0,75%,110.0,110.0,110.0,8,4
2024-08-23,Christian Nodal,,,,,,,,,,,,,,,,,,,,,,,,,,,,2024.0,24333623.0,0.0,24333623.0,1,,Coliseo de Puerto Rico,Hato Rey,Puerto Rico,United States,,Arena,US DOLLAR,"Cárdenas Marketing Network (CMN), Jose Dueño Entertainment, Seba Rock Entertainment",Latin,13613.0,1008495.0,14620.0,93%,35.0,125.0,74.08,8,4
2024-08-23,Paul Thorn,,,,,,,,,,,,,,,,,,,,,,,,,,,,2024.0,52212.0,0.0,52212.0,1,Dave Hause,Knuckleheads,Kansas City,Missouri,United States,Kansas City,Club,US DOLLAR,(In-House Promotion),"Americana, Blues, Pop / Rock",347.0,8675.0,1200.0,28%,25.0,25.0,25.0,8,4
2024-08-23,"""Rockin' on the River"", Adrenalize - Def Leppard Tribute",,,,,,,,,,,,,,,,,,,,,,,,,,,,2024.0,0.0,0.0,,1,,Black River Landing,Lorain,Ohio,United States,Cleveland-Akron (Canton) ,Outdoor Venues,US DOLLAR,(In-House Promotion),"Multi-Genre, Tribute Acts",6000.0,60000.0,6000.0,100%,10.0,10.0,10.0,8,4
2024-08-23,Spyro Gyra,,,,,,,,,,,,,,,,,,,,,,,,,,,,2024.0,228736.0,0.0,228736.0,1,,Spire Center For Performing Arts,Plymouth,Massachusetts,United States,Boston (Manchester) ,Auditorium / Theatre,US DOLLAR,(In-House Promotion),Jazz,248.0,17192.0,265.0,93%,63.0,70.0,69.32,8,4
2024-08-23,"""The Happy Together Tour"", The Turtles feat. Flo & Eddie","""The Happy Together Tour"", The Turtles feat. Flo & Eddie",['classic rock'],9725.0,29.0,"""The Happy Together Tour"", The Turtles feat. Flo & Eddie",UCAFMpl408u--fnnhntYKyVQ,Henrietta Gacey,That boy ain't right.,2010-12-27T04:23:20Z,4411.0,6.0,10.0,873.0,65.0,78.0,31.0,52.0,35.0,134.0,127.0,59.0,48.0,44.0,77.0,105.0,18.0,37.7,2024.0,0.0,933604.0,933604.0,1,"Jay and The Americans, The Association, Badfinger Feat. Joey Molland, The Vogues, The Cowsills",Blue Gate Performing Arts Center,Shipshewana,Indiana,United States,South Bend-Elkhart,Auditorium / Theatre,US DOLLAR,(In-House Promotion),Pop / Rock,1481.0,123205.95,1481.0,100%,49.95,119.95,83.19,8,4
2024-08-23,Kolby Cooper,,,,,,,,,,,,,,,,,,,,,,,,,,,,2024.0,0.0,0.0,,1,,Schoepf's Old Time BBQ Pit,Belton,Texas,United States,Waco-Temple-Bryan,Club,US DOLLAR,(In-House Promotion),Country,713.0,17670.0,2588.0,27%,15.0,500.0,24.78,8,4
2024-08-23,Tim Hawkins,,,,,,,,,,,,,,,,,,,,,,,,,,,,2024.0,58377.0,0.0,58377.0,1,,Calvary Christian Center,Ormond Beach,Florida,United States,Orlando-Daytona Beach-Melbourne ,Auditorium / Theatre,US DOLLAR,Awakening Events,Comedy,1919.0,54235.0,2200.0,87%,29.75,69.75,28.26,8,4
2024-08-23,Drew Afualo,Drew Afualo,['post-teen pop'],197654.0,43.0,Drew Afualo,UCbTAxBINCidtsqVTO1qygvw,Drew Afualo,The Baba Yaga of bigots/misogynists is here!! I'm so excited to connect w yall on a deeper level and also talk as much shit as I want LMAO. Follow a bitch on here and let's have bestie time foreverrrrr ,2011-12-09T14:59:53Z,268894.0,11000.0,80.0,1001176.0,53594.0,57017.0,63505.0,63169.0,67293.0,154507.0,145736.0,138861.0,64796.0,55495.0,79882.0,39383.0,17938.0,37.8,2024.0,0.0,0.0,,1,,Montgomery Theater,San Jose,California,United States,San Francisco-Oakland-San Jose,Auditorium / Theatre,US DOLLAR,Another Planet Entertainment,Pop / Rock,443.0,20410.8,443.0,100%,35.0,55.0,46.07,8,4
2024-08-23,Chayanne,,,,,,,,,,,,,,,,,,,,,,,,,,,,2024.0,13638204.0,0.0,13638204.0,1,,Climate Pledge Arena,Seattle,Washington,United States,Seattle-Tacoma,Arena,US DOLLAR,Cárdenas Marketing Network (CMN),Latin,5924.0,681938.5,7221.0,82%,41.0,41.0,115.11,8,4
2024-08-23,Koe Wetzel,,,,,,,,,,,,,,,,,,,,,,,,,,,,2024.0,7109875.0,0.0,7109875.0,1,,Stage AE / Outdoor,Pittsburgh,Pennsylvania,United States,Pittsburgh,Outdoor Venues,US DOLLAR,AEG Presents,"Americana, Country, Pop / Rock",4750.0,282453.9,4750.0,100%,37.13,79.5,59.46,8,4
2024-08-23,One Vision of Queen feat. Marc Martel,,,,,,,,,,,,,,,,,,,,,,,,,,,,2024.0,0.0,0.0,,1,,DPAC,Durham,North Carolina,United States,Raleigh-Durham (Fayetteville) ,Auditorium / Theatre,US DOLLAR,(In-House Promotion),"Pop / Rock, Tribute Acts",2345.0,133795.5,2704.0,86%,39.5,79.5,57.06,8,4
2024-08-23,Colde,,,,,,,,,,,,,,,,,,,,,,,,,,,,2024.0,1845070.0,0.0,1845070.0,1,"Basecamp, Jiwoo",Citizens House of Blues Boston,Boston,Massachusetts,United States,Boston (Manchester) ,Club,US DOLLAR,Live Nation,Asian Pop,1022.0,42965.0,2425.0,42%,15.0,165.0,42.04,8,4
2024-08-23,Sam Hunt,,,,,,,,,,,,,,,,,,,,,,,,,,,,2024.0,7831956.0,0.0,7831956.0,1,Ryan and Rory,Radians Amphitheater At Memphis Botanic Garden,Memphis,Tennessee,United States,Memphis,Amphitheatre,US DOLLAR,(In-House Promotion),Country,5488.0,504708.0,7450.0,73%,62.0,200.0,91.97,8,4
2024-08-23,"""Brat Rave""",,,,,,,,,,,,,,,,,,,,,,,,,,,,2024.0,0.0,0.0,,1,,Newport Music Hall,Columbus,Ohio,United States,"Columbus, OH ",Auditorium / Theatre,US DOLLAR,"(In-House Promotion), AEG Presents, PromoWest Productions",Dance / Electronic,938.0,22495.0,1000.0,93%,17.0,50.0,23.98,8,4
2024-08-23,Becky Robinson,,,,,,,,,,,,,,,,,,,,,,,,,,,,2024.0,0.0,0.0,,4,,Comedy Off Broadway,Lexington,Kentucky,United States,,Untyped Venue,US DOLLAR,(In-House Promotion),Comedy,213.0,5831.25,257.0,82%,25.0,35.0,27.34,8,4
2024-08-23,Usher,,,,,,,,,,,,,,,,,,,,,,,,,,,,2024.0,40401674.0,0.0,40401674.0,2,,CFG Bank Arena,Baltimore,Maryland,United States,Baltimore,Arena,US DOLLAR,Live Nation,RB / Soul,11565.0,2265037.25,11565.0,100%,44.5,244.5,195.84,8,4
2024-08-23,Barry Manilow,Barry Manilow,"['adult standards', 'mellow gold', 'soft rock', 'yacht rock']",1714489.0,63.0,Barry Manilow,UC9hl0qKH0UltGQb0Gl0oq-Q,Barry Manilow,"Be sure to tune in for the latest from Manilow every week! 
https://on.barrymanilow.com/trk/pFzL
",2007-10-15T19:13:54Z,262117739.0,314000.0,210.0,411938.0,27755.0,27429.0,28341.0,26856.0,29478.0,62592.0,53899.0,45946.0,23285.0,24373.0,36932.0,17554.0,7498.0,35.6,2024.0,3991651.0,0.0,3991651.0,1,,BOK Center,Tulsa,Oklahoma,United States,Tulsa,Arena,US DOLLAR,"Outback Presents, LLC",Pop / Rock,5406.0,475360.17,5848.0,92%,15.5,495.5,87.93,8,4
2024-08-23,Boyz II Men,,,,,,,,,,,,,,,,,,,,,,,,,,,,2024.0,5907521.0,0.0,5907521.0,1,,The Chelsea,Las Vegas,Nevada,United States,Las Vegas,Club,US DOLLAR,Live Nation,RB / Soul,2007.0,286325.0,2278.0,88%,75.21,380.41,142.66,8,4
2024-08-22,Dark Star Orchestra,,,,,,,,,,,,,,,,,,,,,,,,,,,,2024.0,0.0,0.0,,1,,Frog Alley Brewing,Schenectady,New York,United States,,Club,US DOLLAR,MassConcerts,Tribute Acts,1809.0,84005.0,2000.0,90%,40.0,65.0,46.44,8,3
